{
  "contract_version": "1.0",
  "story_id": "STORY-GH-1001",
  "source_agent": "project_manager",
  "target_agent": "game_designer",
  "dna_compliance": {
    "design_principles_validation": {
      "pedagogical_value": true,
      "policy_to_practice": true,
      "time_respect": true,
      "holistic_thinking": true,
      "professional_tone": true
    },
    "architecture_compliance": {
      "api_first": true,
      "stateless_backend": true,
      "separation_of_concerns": true,
      "simplicity_first": true
    }
  },
  "input_requirements": {
    "required_files": [
      "docs/stories/STORY-GH-1001_description.md",
      "docs/analysis/STORY-GH-1001_feature_analysis.json",
      "docs/breakdown/STORY-GH-1001_story_breakdown.json"
    ],
    "required_data": {
      "feature_description": "[FEATURE] Secure User Registration System for Municipal Training Platform\n\n# \ud83c\udfaf Feature Request for DigiNativa\n\n## \ud83d\udccb Feature Description\n**Brief description of the feature:**\nImplement a secure user registration system that allows municipal employees to create accounts for the DigiNativa training platform with proper role-based access control.\n\n**Detailed description:**\nThe user registration system should enable Swedish municipal employees to register for comprehensive pedagogical training accounts with their work email addresses. The system integrates with municipal HR systems, validates against approved government domains, and creates personalized learning pathways based on department and role. The registration process itself serves as the first learning experience, teaching employees about digital security, GDPR compliance, and their role in municipal service delivery. Users complete a guided onboarding that connects their daily work responsibilities to broader municipal goals while setting up their professional development profile.\n\n## \ud83d\udc65 Target User\n**Primary Persona:** Anna (Municipal Training Coordinator)\n**Alternative Persona:** Municipal employees across all departments\n\n## \ud83c\udf93 Learning Objectives\n- [ ] Understand proper municipal account setup procedures\n- [ ] Learn about role-based access to training materials\n- [ ] Practice secure password creation and account management\n- [ ] Familiarize with GDPR consent and data handling policies\n\n## \u2705 Acceptance Criteria\n- [ ] User can register with valid municipal email address (@kommun.se domains)\n- [ ] System validates email domain against approved municipal domains list\n- [ ] Registration form captures: name, email, department, role, municipality\n- [ ] System sends email verification link within 2 minutes\n- [ ] User can verify email and activate account within 24 hours\n- [ ] Profile setup includes accessibility preferences and learning goals\n- [ ] System assigns appropriate role permissions based on department\n- [ ] Registration process completes within 3 minutes for typical user\n- [ ] GDPR consent is properly captured and documented\n- [ ] System rejects invalid/non-municipal email addresses with clear messaging\n- [ ] Password requirements meet Swedish government security standards\n- [ ] Feature works within 10 minutes completion time constraint\n\n## \u23f1\ufe0f Time Constraints\n**Maximum completion time:** 10 minutes\n**Target completion time:** 5 minutes for experienced municipal users\n\n## \ud83c\udfdb\ufe0f Municipal Context\n**Department:** HR, Education, Administration (all departments)\n**Use case scenario:** \nAnna coordinates comprehensive professional development for Stockholm municipality's 45,000 employees. She needs a registration system that not only provides platform access but also educates employees about their role in municipal service excellence. The system must integrate with existing municipal workflows, respect employee time constraints, and provide immediate value by connecting individual learning goals to departmental objectives and citizen service improvements.\n\n**Policy alignment:**\n- Swedish GDPR implementation (UAVV)\n- Government security guidelines for user authentication\n- Municipal employment verification procedures\n- Accessibility requirements per DOS (Diskrimineringsombudsmannen)\n\n## \ud83c\udfae Game Design Requirements\n**Interaction type:** Progressive learning journey with gamified milestones\n**Pedagogical approach:** Constructivist learning through guided discovery of municipal service connections\n**Difficulty level:** Beginner (adaptive to all technical skill levels with professional municipal context)\n\n## \ud83d\udcca Success Metrics\n- User completion rate: >95%\n- User satisfaction score: >4.2/5.0\n- Average completion time: <5 minutes\n- Email verification rate: >90% within 24 hours\n- Support ticket reduction: 80% fewer registration-related issues\n\n## \ud83d\udea8 Priority Justification\n**Why is this important?**\nThis foundational feature transforms routine account creation into meaningful professional development. By integrating holistic municipal service principles into the registration process, employees immediately understand how their learning connects to citizen service excellence. The system respects busy municipal professionals' time while establishing a culture of continuous improvement that supports both individual growth and organizational effectiveness.\n\n**Urgency level:** High - Required foundation enabling municipal service excellence through learning\n",
      "acceptance_criteria": [
        "*Brief description of the feature:**",
        "*Detailed description:**",
        "*Primary Persona:** Anna (Municipal Training Coordinator)",
        "*Alternative Persona:** Municipal employees across all departments",
        "[ ] Understand proper municipal account setup procedures",
        "User can use this feature as expected",
        "Feature maintains pedagogical value",
        "Feature respects 10-minute time constraint",
        "Feature uses professional tone appropriate for Anna persona",
        "All API endpoints respond within 200ms",
        "Frontend components are accessible (WCAG AA)",
        "Feature works on mobile devices",
        "Code coverage is above 90%",
        "No critical security vulnerabilities",
        "Performance score above 90"
      ],
      "user_persona": "Anna",
      "time_constraint_minutes": 2,
      "learning_objectives": [],
      "priority_level": "high",
      "complexity_assessment": {
        "overall_complexity": "Very Complex",
        "effort_points": 10,
        "technical_complexity": "Medium",
        "design_complexity": "High",
        "integration_complexity": "Low",
        "testing_complexity": "Low",
        "estimated_duration_hours": 64.0,
        "estimated_duration_days": 8.0,
        "risk_factors": [
          "Technical complexity",
          "Timeline constraints"
        ],
        "confidence_level": 0.7000000000000001,
        "implementation_notes": "Implementation involves medium technical complexity and high design complexity.",
        "complexity_breakdown": {
          "frontend_work": 3,
          "backend_work": 2,
          "testing_work": 2,
          "integration_work": 1
        },
        "assessment_timestamp": "2025-06-14T20:52:48.722482"
      },
      "story_breakdown": {
        "story_id": "STORY-202506142052",
        "feature_summary": {
          "title": "[FEATURE] Secure User Registration System for Municipal Training Platform",